id,title,body,author,score,upvote_ratio,num_comments,created_utc,subreddit,keyword,method,category
1mg8yk8,Sobre vaga na TOTVS isso é normal?,"Ainda estou tentando entrar no mercado como Junior faz uns 2 anos, me candidatei em várias empresas mas neste post o foco é Totvs, já me candidatei pra 11 vagas através da TOTVS e 0 retorno. Uma amiga começou a trabalhar lá recentemente e me contou que disseram a ela que abriu uma vaga nova ""speed to hero"" e me mandou um link pra me candidatar, quando me candidatei eu não conseguia pois eu já tinha me candidatado em março e tinha até esquecido, então ela me mandou mais 3 vagas que eu também já havia me candidatado, perguntei se não tinha como ela me indicar diretamente mas ela não comentou nada. 

Então, alguém que trabalha na totvs sabe se isso é normal? pensei que conseguiria uma vaga com uma indicação mas ainda não arrumei um trampo de Dev ou até mesmo relacionado a Ti.",Winter-Paramedic-151,1,1.0,0,1754191083.0,brdev,IA,recent,tecnologia
1mg8rgb,O que fazer com LinkedIn em caso de múltiplos empregos?,"Recentemente consegui um segundo emprego e ainda estou no processo de efetivacão, mandando documentos etc.. 

Inclusive existe um questionário que preciso responder na nova empresa que pede o link do meu LinkedIn, mas não é obrigatório. Mas isso me deixa receoso

atualmente tenho um PJ e agora consegui 1 CLT, o novo emprego CLT fala que não tem impedimentos sobre o colaborador ter outro emprego mas que prefere dedicação exclusiva, mas em nenhum momento me exigiu sair do atual nem perguntou o tempo que eu teria de aviso prévio.
Eu nem vou tocar no assunto pois o meu atual emprego é de horário flexível e eu consigo dar conta dele fora do horario exigido pelo novo emprego CLT.
Em ambos não é exigido dedicação exclusiva, não existe conflito de interesses etc, mas eu quero ficar em paz.

O que devo fazer com meu LinkedIn? para evitar fricção de ambas as partes e manter os dois em paz???

Não quero nenhum colaborador de ambas as partes olhando meu LinkedIn e achando ruim, e as vezes a pessoa é mais influente e ter maior poder que eu. com a possibilidade de poder dar merda para mim. E eu só quero ficar na minha, de boa, fazendo meu trabalho por alguns anos e depois eu penso em reativar para procurar o job ropping

Desabilito minha conta??
Mudo nome e todo conteúdo dela para ficar stef???
O que vocês fariam???",cacimbanet,0,0.25,2,1754190442.0,brdev,IA,recent,tecnologia
1mg6a57,Entrevista Lean Tech,Alguém já fez entrevista técnica recentemente de Java na Lean Tech? Poderia me ajudar dizendo como foi?,xfiredavid440,3,0.81,0,1754182755.0,brdev,IA,recent,tecnologia
1mg4kl3,Como saber qual carreira seguir?,"Eae galera. Só pra contextualizar: eu iniciei uma faculdade de SI recentemente, eu via pelo Reddit uma galera falando q faculdade não era tão bom assim, mas ao menos por enquanto tá tudo muito bom, e quantia de aula prática tá bem equilibrado, pelo q falavam achei q nem teria.

Mas tipo, eu tô perdido em relação a saber qual carreira seguir, pq ser ""só"" um cara q fica fazendo site é um trem q eu acho muito brochante. Eu tava fazendo aquela parte do free code camp sobre API e eu achei bem divertido, eu penso em seguir em uma área que fosse sobre criar um aplicativo pra soluções de um problema / automatizar coisas.

Eu também gosto muito de matemática e já vi que em criptografia usa bastante conceitos de lá, mas dnv, eu não sei quais carreiras lidam com isso, tô perdido kkkk.

Se alguém souber um lugar que dê pra clarear um pouco essas dúvidas eu agradeço, tentei pesquisar pelo Reddit, mas não deu muito reaggea não.",JuninDoCreu,3,0.8,3,1754177696.0,brdev,IA,recent,tecnologia
1mg29v0,Vale a pena arriscar?,"TL;DR: Quais riscos eu devo assumir ao sair de uma vaga como CLT para uma startup americana?

Eu trabalho como CLT em uma consultoria grande há anos. Em geral a experiência tem sido boa e quando eu entrei o salário era bom para o meu tempo de mercado. Apesar disso, quando fui promovido, foi um aumento de salário bem baixo e ficou evidente que o meu crescimento na empresa seria nesse ritmo.

O bom da minha consultaria é que ela tem clientes internacionais bem grandes e recentemente entrei para um cliente americano referência no mercado. É um projeto bem antigo, mas com diversas arquiteturas e tecnologias. Então há espaço para mais aprendizado.

No entanto, fora a limitação do salário há a também limitação do espaço que consigo nos clientes. Por ser de fora da empresa, muitas das vezes eu sinto que estou em uma bolha dentro do clientes e mesmo assumindo mais responsabilidades no projeto não existe promoção dentro do cliente e tampouco abertura para participar de algumas coisas deles.

Eu me dei super bem no meu cliente anterior, de tal forma que fiz amizade com alguns devs de lá e recentemente um deles me indicou para uma startup americana. Agora estou nas entrevistas com eles e estamos indo bem.

É uma empresa em série B, então está em crescimento e estão precisando de mais devs. O produto é interessante e tem iniciativas de open source. Em geral, a aparência é de um projeto diferentinho com tecnologias novas. Mas sei que algumas startups podem ser furada e não podem chegar à série C.

Agora me vejo dividido: ou fico em um trabalho estável, com projetos grandes, que paga as contas da minha família? Ou vou para uma startup que vai pagar mais, mas que é instável?

Sei que a decisão é minha, mas como sei que tem gente com várias experiências por aqui queria saber a opinião de vocês.

Vale a pena arriscar?
",im-a-teapot_418,0,0.5,9,1754171318.0,brdev,IA,recent,tecnologia
1mg1uj5,Como funciona um streaming de jogos?,"Normalmente estamos acostumados com streaming de media tipo netflix etc, mas e quando se trata de um console? Por exemplo no playstation 5 só tem a retrocompatibilidade com o playstation 4. Mas o **God of War: Ascension** pode ser jogado no playstation 5 com um tier específico da playstation plus (que até onde sei nunca esteve disponível no brasil).

Seria algo como de alguma forma ""capturar a dela"" de um emulador, e enviar para o console? Porém até o presente momento o mais avançado é o RPCS3 e não existe um emulador oficial utilizado pela sony, o que leva a outra questão, parece que ela usa consoles reais. Como stremar um console real?

Outro ponto, tirando serviços como gamepass que tem parcerias reais com as desenvolvedoras e aparentemente existe um serviço real da azure pra isso que não faço a mínima ideia como funciona, já ouvi falar de um serviço chamado bosteroide que permite você jogar jogos até mesmo de playstation via streaming.

Desculpem a bagunça nos pensamentos, mas stremar um software como um jogo de uma plataforma específica ainda parece algo muito complexo para mim.",banzeiro,2,1.0,7,1754170194.0,brdev,IA,recent,tecnologia
1mg0uqw,Como conciliar entrevistas de emprego durante um emprego presencial?,"Não vou me alongar muito.

  
Atualmente trabalho em uma pequena empresa 100% presencial, longe de casa, e o ambiente é de certa forma controlado. Essa semanas duas empresas entraram em contato comigo com propostas MUITO atraentes e eu vou precisar entrar na jornada de conversas com RH, time técnico e etc por video chamada.  


Alguma ideia de como eu poderia conciliar isso sem levantar suspeitas?",Big_Ride_140,2,0.75,6,1754167615.0,brdev,IA,recent,tecnologia
1mfzr64,Como/onde procurar primeiras experiências?,"Quero trabalhar pro exterior como assistente virtual usando principalmente gerenciamento de email, documentos e planilhas. Tenho inclusive habilidades consideradas avançadas por um amigo que já trabalhou na área aqui no brasil mas não sei onde, como ou com quem procurar primeiras experiências reais e o mercado vive aquele paradoxo da experiência. Precisa de experiência pra trabalhar mas precisa trabalhar pra ter experiência.

Procuro aqui por dicas de experientes em trabalhar pro exterior em quaisquer áreas de atuação como eu deveria ou poderia seguir. Agradeço o tempo e gentileza de quem se dispôr a me dar algum norte.",FewIdeal8697,0,0.25,2,1754164761.0,brdev,IA,recent,tecnologia
1mfyseo,Relatei um vazamento de dados da lgpd para a empresa que eu trabalho e não sou dev aqui,"Oi pessoal, recentemente eu tive um problema sério comigo mesmo que é o fato que eu não faço ideia de como me vender, no momento eu sou atendente de uma empresa grande e faz 1 semana que eu comecei, minhas habilidades tecnicas como dev são de ser fullstack visto que eu recentemente tive um case de uma startup que eu codifiquei em 1 mes e recebeu um valuation de investimento de 1.5M que eu trabalhei esse ano todo até o mes passado, como o investimento provavelmente não se pagou por conta da natureza da startup não é possivel continuar trabalhando nela e então eu achei esse emprego que eu recebo 1300 reais por mes, mas pelo menos eu iria conseguir pagar alguma coisa e comer nos proximos meses sem gastar o que eu tenho guardado.

o que acontece é o seguinte, quando eu passei no processo de recrutamento eu encontrei umas ""vulnerabilidades"" no site do RH dessa empresa que são só vulnerabilidades entre muitas aspas pois achei uma coisa que estava expondo sem ter que se quer tentar hackear o site da empresa, similar ao caso recente daquele app de namoro, os dados CONFIDENCIAS dos funcionarios estão simplesmente publicos pra qualquer um que conseguisse ver a requisição ali e eles ja tinham um comando no front q puxava todos esses dados dos funcionarios tambem, isso inclui RG, CPF, Nome da mãe, pai, endereço tudo que pedem no RH.

Eu acabei relatando o caso as pessoas que são mais superiores as gerentes que só ficam abaixo da super intendencia da empresa e vou estar mostrando essa ""falha"" na segunda feira, e queria saber se fiz certo, inicialmente eu ia mostrar isso no meu primeiro dia, mas acreditei que eu acreditar que seria remanejado de setor por conta disso não seria possivel então ia deixar a falha la e ignorar como se não existisse, mas recentemente senti que isso era meio anti etico deixar até que alguem descubra e possa potencialmente vazar esses dados pessoais das pessoas ou vender isso e então relatei

eu queria saber se eu fiz certo mesmo que eu não espere algo em troca, ou eu deveria esperar algo em troca?",Yuuuuzu,14,0.89,7,1754162263.0,brdev,IA,recent,tecnologia
1mfuvdt,como é a equipe de engenharia do time de vocês?,"trabalho em uma empresa onde as três equipes (engenharia, suporte e negócios) sempre mantém contato. nos cuidados de um e-commerce (site, aplicativo e plataforma) simplesmente o time de engenharia esnoba todas as sugestões que o restante do time propõe tanto de experiência do usuário,
como de funcionalidades e etc. isso é normal em qualquer empresa?

exemplo: os clientes não conseguem editar o perfil no aplicativo, mas pra equipe de engenharia a culpa é do cliente que é burro ou lerdo, mas não dá experiência / interface do aplicativo.


exemplo 2: o fluxo para acionar o suporte via whatsapp confunde os clientes, o suporte e o time de engenharia acha que os clientes quê são burros e não sabem usar o suporte, mas eu bato na tecla que se tem dificuldade no uso, falta experiência do usuário e interface intuitiva.


por deus, tá sendo a maior prova de estresse, toda sugestão é tratado com esnobação e pouco caso, tô quase desistindo da área de tecnologia pois tenho medo de ter lugares piores. na empresa de vocês é assim? o que vocês fariam no meu lugar? ignoraria essas sugestões dos clientes e encheria banana? 

eu estou errado? meu pensamento é errado? não é possível que esteja gastando energia atoa, tô quase tendo um burnout ",Advanced_Shoe_1395,5,0.86,8,1754152361.0,brdev,IA,recent,tecnologia
1mf3jyy,Consegui a primeira vaga de um jeito peculiar e não está sendo como imaginei.,"Fala galera, queria dar meu relato sobre a área e fazer uma pergunta, consegui a primeira oportunidade vendo um post no linkedin, basicamente era fazer um fork de um projeto e fazer o crud a partir disso(teste técnico era isso), usei clean arch(só pra aproveitar que já estava estudando sobre isso) e mandei, depois chamei o care que postou e avisei que tinha mandado e tal, deu umas 2 semanas ele me chamou falando se ainda tinha interesse, eu falei que sim e ele fez mais algumas perguntas técnicas depois pediu meu número(a entrevista foi isso kkkk), passou um tempo o dono da empresa me chamou e dai pra frente foi burocracia de contrato e etc(vaga é pj).

Desde então estou atuando nessa empresa, mas ela funciona por demanda, então a empresa tem vários projetos e clientes, logo de cara me colocaram em um projeto pra ser o único backend(lembrando é a minha primeira oportunidade como dev) eu avisei que era meu primeiro contato com o mercado de fato e falaram que não tinha problema, tenho dado conta até o momento mas o que me pega é que tenho usado muito o chatgpt pra saber como fazer as coisas, porém eu sempre pergunto o porque e como fazer e mesmo que ele gere eu digito linha por linha pra fixar o que estou fazendo, e tem sido assim, aprendi bastante coisa dessa maneira mas as vezes me bate a duvida se estou fazendo certo indo dessa maneira.

Queria perguntar se acham que posso me prejudicar à longo prazo nas hard skills agindo assim?


ps: minha stack na empresa é node",Comprehensive-Tip919,2,0.75,5,1754071285.0,brdev,IA,recent,tecnologia
1mfqcsz,Transição para TI na Automação Industrial – dicas de quem veio da área de TI?,"Trabalho na área de controle e automação industrial, e nos últimos anos tenho percebido o quanto a TI está se fundindo com essa área.

Anos atrás, bastava ter uma boa base em elétrica, programação LADDER de CLPs, IHM e SCADA. Hoje em dia, vejo cada vez mais projetos exigindo conhecimentos sólidos em SQL, C#, autenticação, integração com sistemas ERP, geração de relatórios com Pandas/Python, NodeRED, Grafana, etc.

Minha rotina é maluca: num mesmo dia posso ligar um motor elétrico, refazer fiação de sensores, comissionar inversores, testar válvulas pneumáticas e, à tarde, integrar dados com um ERP via SQL Server ou gerar relatórios em Python.

Minha formação é em engenharia (como a maioria dos colegas de automação), então às vezes fico sem referência para avaliar se certos requisitos de software são realistas ou se estão fora da curva. 

É uma área que possui muitas viagens também, atualmente estou atuando bastante em projetos internacionais e o inglês não é problema pra mim...

Tenho estudado por conta própria (Udemy, etc), mas fico com a sensação de que posso estar ficando para trás. Gostaria de ouvir dicas de quem veio da área de TI e atua hoje em automação:

* O que vocês recomendam estudar com prioridade?
* Quais tecnologias fazem mais diferença na prática?
* Tem alguma base conceitual de TI que vocês acham essencial dominar para projetos de automação modernos?

Valeuuu",AssociationIll3893,2,1.0,0,1754140732.0,brdev,IA,recent,tecnologia
1mfpusl,Quais foram as melhores empresas que vcs ja trabalharam?,Qual empresa vcs tiveram a  melhor experiência de trabalho? Em salario e ambiente/pessoas?,nahIdWin29,32,0.93,60,1754139271.0,brdev,IA,recent,tecnologia
1mfj3ds,Qual o melhor caminho a seguir? Qual a melhor trajetória? Pergunta aos Devs Seniors e acima,"Olá, tenho 18 anos e faço ADS no Instituto Federal do meu Estado. Entretanto, como sonho e objetivo, almejo alcançar uma FAANG ou Big Tech e morar fora. Tenho como plano terminar o meu curso(que dura 3 anos) e, assim que terminar, riscar para SP e me matricular para Eng de Software na FIAP ou, se possível, prestar a Fuvest e fazer SI na USP. aos Devs que já alcançaram tal objetivo, estou no caminho certo? Para quem quer uma carreira grande, vale a pena fazer FIAP? Não ficaria sozinho pois eu dividiria aluguel com alguns amigos que também querem evoluir na carreira.  ",Dreamy_Stranger,3,0.64,26,1754114277.0,brdev,IA,recent,tecnologia
1mfeumk,"Vi minha vaga anunciada no In, vou rodar?","Contexto: sou o único analista de projetos do produto, clt e híbrido 3x na sede. Tenho total domínio e executo minha função com muitos elogios da gerência.

Agora à noite abro o IN e vejo o tech recruiter anunciando uma vaga de gerente de projetos, 100% remoto e PJ. A descrição da vaga basicamente sou eu, em cada detalhe.

E como sei que é para o meu produto? Porque minha chefe foi marcada na publicação.

Não sei se vou rodar (não tenho feedbacks negativos que justifiquem), se questiono minha chefe, se fico quieto e busco outra coisa... só sei que fiquei chateado por saber que estão buscando alguém pra fazer tudo que eu faço, em condições melhores (só de ser remoto já é um paraíso em sp). Já pedi pra ser remoto no passado antes e foi negado...

Alguém já passou por algo semelhante?",IceCream-Cold,131,0.97,67,1754100499.0,brdev,IA,recent,tecnologia
1mfegpm,Análise de Perfil e GitHub: Estudante de Backend (Python/Java) buscando feedback para o 1º estágio.,"Olá, pessoal do r/brdev!

Sou estudante de Engenharia da Computação (4º semestre) e estou me dedicando intensamente para conseguir um bom estágio em Backend a partir de 2026. E gostaria de um feedback mais aprofundado sobre meu **perfil técnico, meus projetos no GitHub e minha estratégia de estudos.**

**Meu GitHub:** [https://github.com/PHVital](https://github.com/PHVital)

**Contexto Rápido:**

* **Projeto Principal (Python/Django):** Construí uma API de banco digital do zero, com foco total em boas práticas de engenharia (arquitetura em camadas, testes automatizados, CI/CD, Docker, deploy na nuvem). Está no repositório `projeto-banco`.
* **Estudos Atuais (Java/Spring):** Estou fazendo uma imersão no ecossistema Java, aplicando os conceitos de POO e agora iniciando em Spring. Meu progresso está no repositório `dio-bootcamp-santander`.

**Minhas Dúvidas para a Comunidade:**

1. **Nível Técnico:** Olhando meu projeto principal (`projeto-banco`), a complexidade e as práticas que apliquei (testes, CI/CD, etc.) são suficientes para me destacar para uma vaga de estágio ou júnior em uma boa empresa de tecnologia?
2. **Lacunas (Gaps):** Qual seria a ""lacuna"" mais óbvia no meu portfólio? O que, na opinião de vocês, eu deveria focar em aprender ou construir a seguir para me tornar um candidato mais forte?
3. **Qualidade do Código:** Para quem tiver um tempo, o código em si (organização, clareza, padrões) nos projetos parece profissional? Aceito críticas duras!

Agradeço imensamente qualquer tempo e insight que puderem compartilhar!",Technical_Rip_6218,2,1.0,4,1754099337.0,brdev,IA,recent,tecnologia
1mfe7om,"Isso é loucura?? (Portugol, Python)","Contextualizando, estou começando a estudar programação. Mas não demorou muito para as dúvidas começarem a surgir. A primeira delas é: Qual a melhor maneira de estudar lógica de programação? Grande parte das pessoas dizem que é uma péssima ideia começar aprender lógica de programação com Portugol porque é uma linguagem inútil, mas o objetivo é aprender lógica de programação e não Portugol, se eu estivesse tentando criar um programa sofisticado com o Portugol ai sim eu teria um problema, certo? Mas não, o objetivo não seria aprender a raciocinar, pensar de forma estratégica, aprender a criar blocos de pensamento 'caminhos mentais' para solucionar problemas,  em outras palavras, aprender a pensar? É uma dúvida genuína. Porém sim, se formos pensar em questão de eficiência (utilidade e tempo) seria muito melhor aprender com Python, já que eu poderia aplicar o conhecimento em uma linguagem do ""mundo real"" digamos assim. Não sei bem o que pensar sobre isso. Mas eu tenho uma alternativa a essa abordagem onde é 8 ou 80, que parece funcionar bem (pelo menos na minha cabeça)

Aprender a lógica com Portugol, porque ajuda a focar no raciocínio e não na sintaxe, e porque me parece ideal para organizar o pensamento. E, simultaneamente, aplicar os mesmos conceitos em Python (ou na linguagem que você quer aprender lógica de programação) porque é uma linguagem útil, real, e profissional, ou seja, você já treina para o mercado e refina seu pensamento vendo o mesmo problema de uma outra forma.

Você está fazendo uma tradução consciente do raciocínio para prática. Você pensa em lógica com algo leve (Portugol), depois transforma isso em código real (Python).

* Você **já sabe o que o algoritmo precisa fazer**
* Só precisa **aprender** ***como*** **dizer isso em Python** — ou na linguagem que você quer aprender.

Bem, mas isso não passa de tão somente uma ideia louca minha, e como eu ainda não coloquei em prática essa abordagem, ainda não tive a chance de cobrir as desvantagens ou pontos negativos que só serão revelados com a prática. 

Mas iae, o que você acha dessa abordagem, é realmente uma loucura?",apenasumestranho1,1,0.6,25,1754098590.0,brdev,IA,recent,tecnologia
1mfe12j,"Essa tal de ""g2i.co"" é legit?","Candidatei no LinkedIn para uma vaga de desenvolvedor de IA, recebi um e-mail com uma tarefa simples em Python (refatorar uma API) e, 5 dias depois, fui aprovado para a mesma vaga, com a promessa de um salário de US$ 30 a US$ 40 por hora, pedindo para me cadastrar no alignerr e verificar algumas informações pessoais. Minha pergunta é: a empresa é legítima? Já vi muitas avaliações mistas e várias mensagens com cara de bot.",Kampur,2,1.0,3,1754098038.0,brdev,IA,recent,tecnologia
1mew9xn,Whatsapp API - Evolution API X Twilio,"Salve, estou com uma grande dúvida,  
preciso desenvolver um sistema de mensagens automáticas via Whatsapp, para clientes da empresa na qual trabalho.  
Depois de pesquisar um pouco cheguei em duas opções, ou eu uso a plataforma da Twilio, que pode acabar custando mais caro porém tem a garantia de segurança e é uma via oficial, ou eu uso o EvolutionAPI, que só preciso pagar pelo host, porém tenho mais chances de tomar bloqueio no número da empresa.

Gostaria de saber um pouco mais de quem já mexeu com isso, qual seriam as coisas mais importantes que eu tenho que levar em conta para fazer essa escolha, e se é tão ""perigoso"" assim utilizar um meio não oficial para a API do Whatsapp.

Ou caso tenham outras sugestões de serviços/métodos, para me recomendarem, ficarei grato.",4L3XHoff,1,1.0,2,1754054318.0,brdev,IA,recent,tecnologia
1mfcdji,"Somos reconhecidos como ótimos programadores e arquitetos de software, mas quais escreveram livros técnicos reconhecidos ?",Conheço várias pessoas ótimas no mercado e várias que saíram pra gringa por serem reconhecidas como ótimas e realmente são! Mas não vejo a gente revolucionar o mercado ou abrir uma grande empresa Tech e muito menos não vejo ou recebo recomendações de escritores brasileiro as técnicos! Pq?,Clyrigham,0,0.33,21,1754093144.0,brdev,IA,recent,tecnologia
1gdb72o,Linus Torvalds diz que onda de inteligência artificial é 90% marketing,"Em entrevista recente, Linus Torvalds demonstra não ser contrário à IA, mas vê movimento atual como ""90% marketing e 10% realidade""",LaFenix98K,445,0.98,101,1730036437.0,brdev,inteligência artificial,search,tecnologia
1j5cme1,O estouro da bolha da inteligência artificial nas startups,,lmg_bsb,107,0.94,51,1741313158.0,brdev,inteligência artificial,search,tecnologia
1kmlfoy,Qual inteligência artificial assinar?,"Qual inteligência artificial vale mais apenas assinar, pensando em uma que crie códigos, ensine bem e também dê boas respostas. O DeepSeek apesar de ""gratuito"" (já que precisa pagar pra usar a API dele) ele sempre para de responder por estar sendo muito usado.",alexspereir61,1,0.56,36,1747244474.0,brdev,inteligência artificial,search,tecnologia
1hw8bvw,É obrigatório saber álgebra linear e matemática avançada para trabalhar com inteligência artificial?,"
Olá, pessoal! Estou pensando em migrar para a área de inteligência artificial e estou estudando as possibilidades. Tenho interesse em aprender machine learning e outras aplicações práticas, mas não tenho um conhecimento profundo em álgebra linear ou matemática avançada, como cálculo diferencial e estatística complexa.

Minha pergunta é:
	1.	Esses conhecimentos são realmente essenciais para entrar na área de IA?
	2.	Há algum tipo de trabalho ou posição dentro de IA (como utilizar ferramentas prontas ou frameworks como TensorFlow, PyTorch, etc.) que não exija tanto domínio matemático?
	3.	Vocês poderiam compartilhar experiências ou sugestões de como começar sem um conhecimento matemático muito avançado?

Agradeço desde já pela ajuda!",Successful_Gap_2736,1,0.52,36,1736300962.0,brdev,inteligência artificial,search,tecnologia
1kggmi5,caí de paraquedas aqui e tenho duas perguntas: programação é tão lucrativo assim? Vocês não têm medo dessa evolução da inteligência artificial?,"Sou de outra área e pelo que vi aqui tem gente dizendo que ganha 40,60,70 mil reais trabalhando para empresas de fora… A mão de obra é tão escassa assim? Na minha cabeça tinham vários indianos craques em programação que aceitariam ganhar MUITO menos.

E essa questão da inteligência artificial também fiquei em dúvida se não era uma ameaça para vocês… Pois pelo que vejo, daqui a cinco, no máximo dez anos boa parte das profissões serão substituídas, e acredito que programação será uma delas (ou não né kkkkk)",TranslatorOk5954,0,0.32,13,1746567772.0,brdev,inteligência artificial,search,tecnologia
