id,title,body,author,score,upvote_ratio,num_comments,created_utc,subreddit,keyword,method,category
1mg9qv1,[Ajuda] Não consigo lembrar o nome dessa HQ,"Por volta de 2012 mais ou menos, pedi ao meu pai que me trouxesse uma HQ na volta do trabalho e eis que ele me traz 2 edições de uma parada que nunca mais conseguiria encontrar depois.

A HQ em si tinha um tom satírico, bastante sarcástico, mencionava apenas heróis da DC então creio que tivesse alguma ligação com o DC estúdios pois eles falavam abertamente de nomes de heróis e suas histórias.

O nome do personagem principal era (eu acho) Stanley, um nerd desengonçado que trabalhava em uma loja de quadrinhos, tinha um chefe abusivo que torrava a paciência dele, um crush em uma loira que esnobava ele e tinha um valentão que era o crush da loira. Isso é mais ou menos do que lembro do enredo.

Stanley não era um super-herói, mas ficava viajando nas histórias dos heróis que ele vendia na loja até que coisas bizarras aconteciam.

Lembro que em uma edição, ele está lendo a história de origem do Hal Jordan, paralelo a isso, um soldado da tropa dos Lanterna Verdes morre na Terra e seu anel é enviado ao Stanley, transformando ele em um lanterna verde real. Ele sai em missão como lanterna verde e a história é carregada de sátira à história de origem do Hal Jordan.

Na outra edição, acredito que ele encontra o super-homem, mas não lembro de detalhes dessa história.

Isso é basicamente tudo que eu me lembro, se acender uma luz na cabeça de alguém agradeço pois já pesquisei, perguntei pra Chat GPT e não consigo achar. Queria encontrar pois lembro de achar essa HQ muito engraçada, tinha uma pegada meio Adult Swin mas com heróis da DC.

Edit: adicionando detalhes.",Calakmul,3,1.0,0,1754193625.0,brasil,IA,recent,geral
1mg9b7t,Morango do amor prova que NÃO existe doutrinação marxista nas escolas.,"Vi uma tal de Nanda Schmidt no TikTok com aquela velha história de que ""mercadoria X prova que a teoria do valor de Marx está errada"", usando os altos preços do morango do amor pra falar coisas sem sentido. Fiquei lendo os comentários por alguns minutos, só por curiosidade, e vi um monte de gente concordando...

Isso me mostra duas coisas:

1. Não existe doutrinação marxista nas escolas e universidades.
2. Existe uma tentativa (talvez ainda não consolidada) de doutrinação **anti-marxista** pela direita.

É incrível como as pessoas falam de um assunto de forma totalmente errada, com ares de entendido. É praticamente um terraplanismo socialmente aceito. Gente dizendo que tem ensino superior, formada em economia e etc., falando uma bobagem absurda e atribuindo a Marx. Não tem nenhum problema não saber, o problema é fingir/achar que sabe.

Se existisse doutrinação marxista nas escolas, as pessoas entenderiam pelo menos o básico: que preço e valor não são a mesma coisa, e que valor **não é**  o tempo de trabalho para produzir uma mercadoria. Se alguém desse mais uns 3 passos na teoria de Marx, veria que existem mercadorias que têm preço, mas não têm valor...

Pelo contrário, existe um movimento claro de distorcer a teoria marxista, incentivando as pessoas a terem aversão a qualquer discussão do tipo.",No-Fish-9989,11,0.87,9,1754192214.0,brasil,IA,recent,geral
1mg8aa2,Você também sente saudade do Brasil antes de 2013?,"Lembro de um tempo — e não faz tanto assim — em que política era coisa de gente chata. Não no sentido pejorativo, mas naquela ideia de que o político era alguém distante, sisudo, técnico até demais. A gente mal lembrava o nome dos ministros. Tinha corrupção? Tinha. Mas havia também uma certa estabilidade social, uma paz silenciosa entre os que discordavam.

Tudo começou a mudar ali por 2013. Os protestos, que nasceram legítimos e necessários, parecem ter aberto uma caixa de Pandora que ninguém mais conseguiu fechar. De lá pra cá, o Brasil se dividiu em linhas que não têm mais volta. Esquerda e direita viraram rótulos pesados, quase xingamentos. E o que antes era só uma conversa de bar sobre política, hoje é briga, rompimento de amizade, barraco em grupo de família.

Sinto falta da época em que discordar não significava odiar. Quando era possível ouvir um argumento contrário e, no mínimo, pensar sobre ele. Hoje, qualquer opinião vem com o pacote completo de desconfiança, raiva e cancelamento. Não importa mais o conteúdo, só importa de que lado você está — seja lá o que isso signifique.

A política virou entretenimento, e os políticos, celebridades. O tom professoral deu lugar ao discurso inflamado. O debate virou grito. O diálogo, trincheira. Vivemos tempos em que é mais importante vencer uma discussão do que entender o outro. E nisso, perdemos a chance de reconstruir pontes que nos faziam, minimamente, parte de um mesmo povo.

Talvez seja utópico querer voltar ao “antes”. O mundo gira, as redes mudam tudo, a informação corre mais rápido do que conseguimos digerir. Mas às vezes me pego pensando: será que não fomos longe demais?

Será que dá pra reaprender a conversar? Dá pra voltar a ver o outro como alguém que apenas pensa diferente — e não como um inimigo?

Não tenho todas as respostas. Mas tenho saudade. Saudade de um Brasil onde as pessoas se olhavam nos olhos sem primeiro perguntar em quem o outro votou.

",Scary_Rest_5530,47,0.89,19,1754188933.0,brasil,IA,recent,geral
1mg8512,STF anexa ação sobre perseguição armada em pedido de extradição de Zambelli,"""O ministro Gilmar Mendes, do Supremo Tribunal Federal (STF), determinou que a Advocacia-Geral da União (AGU) anexe no pedido de extradição da deputada federal licenciada Carla Zambelli (PL-SP) o processo que a parlamentar é ré no STF por sacar, apontar e perseguir uma pessoa com uma arma de fogo, pelas rua de São Paulo, em 2022.

A determinação foi tomada após o ministro Kassio Nunes Marques devolver o pedido de vistas do caso e o processo voltar a tramitar na Suprema Corte. Com isso, o STF agendou para 15 de agosto o julgamento da ré Carla Zambelli.""",SineMemoria,34,1.0,0,1754188485.0,brasil,IA,recent,geral
1mg7vxu,"A araucária é uma joia da biodiversidade brasileira que precisa da nossa ajuda. Precisamos plantar essa espécie, galera do Sul e Sudeste. No passado, foi a fonte de alimento para nativos e colonizadores, mas depois foi quase extinguida por conta da sua madeira.","Para plantar araucárias, você pode procurar na internet explicações simples. É uma árvore de grande porte, então plante ela em praças e espaços abertos. Com pessoas e ONGs dispostas, podemos evitar que as mudanças climáticas e o desmatamento acabem com a Araucária. Aqui estão algumas páginas do instagram sobre a espécie:

Araucariasdobrasil
Apremavi
Minhaaraucaria
Araukapoa
Proaraucaria
Parna.araucarias
Araucariasdamantiqueira",Prestigious-Back-981,79,1.0,6,1754187727.0,brasil,IA,recent,geral
1mg7re3,Em que momento normalizamos esses preços em fast food?,"Abri o Ifood aqui pra um lanchinho de sábado a noite e me deparo com isso logo na tela inicial.

Simplesmente 75 fucking pilas num combo de McDonald's... Alguém tem uma explicação plausível pra isso?",JuliusRockBR,4,0.6,13,1754187339.0,brasil,IA,recent,geral
1mg72rj,As opções bizarras da pesquisa de intenção de voto do Datafolha,"Qualquer um que sabe o mínimo de política sabe que esse cenário com 4 de direita é maluquice, pra mim o único objetivo disso é tentar uma narrativa do tipo somando todos candidatos de direita o Lula perde.

Enfim, me parece pura manipulação da nossa mídia tradicional ",Proper_Indication_62,51,0.96,20,1754185217.0,brasil,IA,recent,geral
1mg5vuj,"Agro aceita tarifaço para garantir anistia a Bolsonaro, diz deputado de MS",,matheushpsa,49,0.92,24,1754181554.0,brasil,IA,recent,geral
1mg5vnn,Senado disponibiliza consulta sobre criaçâo de anuênio para servidoras e servidores públicos - Fenajufe,"Pessoal, dêem seus pitacos nesse projeto de lei! Importante demais.",temporaryacc291,8,1.0,1,1754181538.0,brasil,IA,recent,geral
1mg5uiq,Fábricas da Petrobras reduzem dependência brasileira de fertilizantes nitrogenados,"Segundo a presidente da companhia, Magda Chambriard, a entrada em operação de quatro fábricas nos estados do Paraná, Bahia, Sergipe e Mato Grosso do Sul atenderá 35% da demanda nacional por fertilizantes à base de ureia até 2028. Atualmente, **quase 100% da ureia** utilizada pela agricultura brasileira **vem de fora do país**.",perpetual_state,80,1.0,7,1754181443.0,brasil,IA,recent,geral
1mg5ley,"Questionando por onde anda aquele ""comentarista"" que dizia que a seleção feminina nunca ganha nada e diz também que elas só lacram no esporte",,Jose-Erik,1,0.53,6,1754180682.0,brasil,IA,recent,geral
1mg5frc,Brasil vence a Colômbia e conquista nono título na Copa América Feminina; veja campeãs,"É do BRASIIIIIIIIIL! 🇧🇷💚💛 

O torneio teve 10 edições e o Brasil venceu 9 

🇧🇷 SE BUSCA RIVAL EN SUDAMERICA 🇧🇷",Mallaguetta_SP,80,0.98,1,1754180222.0,brasil,IA,recent,geral
1mg4qkr,Petrobras e Ministério do Desenvolvimento Agrário firmam parceria para o Programa Nacional de Florestas Produtivas,,perpetual_state,19,1.0,0,1754178172.0,brasil,IA,recent,geral
1mg4p7j,"Pará concentra 60% das ações por grilagem na Amazônia Legal, aponta Imazon",,perpetual_state,27,0.97,1,1754178061.0,brasil,IA,recent,geral
1mg485v,Mônica Bergamo: STF não deve proibir bancos de aplicarem sanções de Trump a Moraes,"""No entendimento da maioria dos magistrados, uma decisão do STF empurraria os bancos para uma situação de risco: o governo Trump poderia escolher qualquer um deles, de forma aleatória, para sancionar, inclusive com pesadas multas.

O melhor, portanto, é aguardar para que os próprios bancos estudem a que estão obrigados e que alternativas poderão ser encontradas depois da decisão de Trump.""",SineMemoria,70,0.94,20,1754176712.0,brasil,IA,recent,geral
1mg3h19,6 de outubro de 2024,"6 de outubro de 2024



sabe aquele poema que você vê na escola mas não entende nada?

uns pensam em ""retrato"", outros em ""psicologia de um vencido"" ou até ""vou-me embora para pasárgada""

mas o que mais me deixou intrigado e que mais me fazia refletir sozinho

era um de Drummond, especificamente o ""no Meio do caminho""



um poema simples, de apenas 2 estrofes e 10 versos no total

uma narrativa com falas repetidas, uma história pontual

tive que relê-lo para escrever esta crônica

porque apesar de bonito, a minha memória não é supersônica



bom, o porquê de eu estar citando esse poema? é que eu finalmente o captei

e a revelação veio por meio de um acontecimento real! não foi algo que eu inventei

e que acontecimento seria esse vocês devem estar me perguntando 

mas para que eu conte ele a vocês, vamos dar uns passos para trás, rumo ao passado



era outubro de 2024, o primeiro domingo do mês, o ano era par

e se o ano era par, era certo que a Festa da Democracia™ ia rolar

e se não é ano de copa, é ano das olímpiadas

ano de escolher os vereadores e o prefeito da sua cidadezinha



e como nesse ano eu já tinha 19 anos, já não tinha mais como adiar

ano passado tinha prestado contas à justiça eleitoral, meu título de eleitor estava pronto e regular

e sim, podem me julgar, mas eu não votei nas eleições de 2022, desculpa a franqueza

mas a preguiça venceu a minha vontade de salvar o país com meu voto decisivo, beleza??



e quem lembra especificamente dessa época? sinceramente, só rendeu ouro

Pablo Marçal levando cadeirada do datena, espalhando laudo falso, literalmente cada tesouro

estávamos no BlueSky (ou no Threads) já que à época o Musk tinha brigado com o de Moraes

mas aqui em Salvador, as eleições estavam bem acirradas, era o Bruno Reis e.. basicamente ninguém mais



e no dia da eleição, eu estava até que relativamente animado

é dia de votar! dia de participação! lembrando que seria a primeira vez que eu teria votado

claro, isso se a gente não contar quando votava junto com minha mãe na cabine que decide os eleitos do regime

e era um voto dela e um voto meu, mesmo eu tendo 8 anos ou menos, aliás, pensando bem,tenho quase certeza que acabei de confessar um crime



a zona eleitoral que eu, minha mãe e meu irmão votaríamos era a mesma

uma escola estadual que fica a menos de um quilômetro da minha casa, dava para ir andando igual uma lesma

e decidimos ir caminhando porque estavamos preocupados com o estacionamento e o lugar para botar o carro

na ida, meu tio que acabaria nos levando, a volta? a pé, hoje eu sei, foi um erro crasso



o cenário do local do pleito? o chão lotado de santinho

juro, a cada metro quadrado, uma resma de papelzinho

e já que eu confessei um delito eleitoral, mais gente entra pra turma

tava rolando solta a boca de urna 



e beleza, cada um foi pra sua seção específica, eu lembro até hoje, a minha era a sete

e eu pensei que fosse demorar muito, mas acabou sendo mais rápido que um foguete

a fila que antes minha mãe me contava que era quilométrica

nesse ano, duas pessoas na minha frente, será que foi graças à tecnologia biométrica?



um rápido adendo: não é que eu queira me gabar

mas TODOOS os vereadores que eu votei até hoje acabaram por ganhar

por isso declaro que: meu voto para as eleições 2026 e 2028 estão à venda

candidatos e candidatas, podem me encaminhar por e-mail as suas oferendas (anota mais uma contravenção ai)



ah, um fato importante, como agora tudo relativo às eleições é digital

eu tinha levado o meu celular (e minha carteira com o título, caso não tivesse sinal)

e também, meu irmão e minha mãe também estavam munidos com seus aparelhos

e um contexto adicional: o celular de minha mãe? um iphone 10, o de meu irmão? um oito, o meu era o mais velho



um A03 sem capinha com câmera mais pixelada que minecraft

32 gigabytes de armazenamento, 2 de ram, percebe-se que ele não é tão fast

na minha carteira? dinheiro? nenhum, lamento

um cartão inter, outro nubank, e meus documentos



um fato curioso e que também me deixa triste 

é que nenhum eleitor pode ser preso durante a semana da eleição, pelo menos eu encaro isso como um convite

claro, essa determinação excetua caso o indivíduo seja pego em flagrante

e eu sei que vocês estão com fome para entender o que isso tem a ver com o poema, pois vamos saciar vosso apetite



voltando para casa andando, pisando no meio fio

surgem três indivíduos, dois sem camisa, um meio arredio

meu irmão avisa, implora, suplica ""vamos atravessar, vamos atravessar"" 

eu não tinha visto as figuras suspeitas, e meu irmão, eu também não consegui escutar



estava distraído, conversando com minha mãe sobre algum fato

e os três mosqueteiros se aproximam e anunciam o assalto

eu não tinha entendido, sinceramente estava meio perdido

pensava que iam pedir só dinheiro, pra mim era o que fazia sentido



e quinze segundos depois eu acordei pra vida, tinha sacado

a minha primeira preocupação: eles estão armados?

olhando para as mãos, não vejo nenhuma faca, simulacro ou pistola

mas na palma de um deles uma coisa que até hoje ecoa na minha cachola



uma rocha, uma pedra, um pedregulho

de onde ele tirou aquele bagulho???

e o que ele falou pra mim? ""passa tudo se não eu te quebro todo, bora"" 

a minha reação? ser assaltado por uma pedra é sacanagem, virou questão de honra



eu não entreguei nada e continuei andando tentando passar na frente dele, mas eu já estava meio apurado

e o que ele fez? vocês não vão acreditar, ele enfiou a mão no meu bolso, olha só que mal-educado

pegou de uma vez só meu celular e minha carteira

e a minha reação foi pegar de volta, sim, sem brincadeira



o Ministério da Saúde adverte: em caso de assalto não reaja, sua vida é mais importante do que qualquer bem material

eu não sei onde é que eu estava com a minha cabeça, com certeza eu tive um peido mental

o ladrão ficou bravo, entendeu meu gesto como um insulto

mas meu irmão, um herói sem capa, um anjo sem asa, se sacrificou no mesmo minuto



entregou de bandeija para o marginal o seu iphone oito

e o bandido que me encarou, se deu como satisfeito

foram embora, meteram o pé

e meu irmão já estava sem fé



""eu avisei a vocês, eu falei para atravessar

é inacreditável como meu irmão não sabe nem andar

e o burro ainda reage, sabendo que estão em vantagem

sério, eles estavam com uma PEDRA, que viagem"" 



""se tivesse sei lá, pelo menos mais um amigo

eu teria reagido"" ele promete

""eu juro a vocês, eu teria descido o cacete""

é inacreditável, isso só acontece comigo



""e da próxima vez, vê se me escuta idiota""

ele estava muito bravo, mas teve uma ação altruísta

tava implícito, eu li nas entrelinhas

era como se ele dissesse: me importo mais com a vida de vocês do que com a minha



e depois do choque inicial, teríamos lembrado

tinha uma guarnição policial ali perto, um posto avançado

já estávamos comprando um pouco água no mercado

e meu irmão se tocou e pensou ""não posso desistir sem ao menos ter tentado""



e ele voltou, sem nenhuma boa notícia

mesmo tendo tentado, não adianta só ter malícia

não podia fazer nada a polícia

normal, no brasil sabemos que tudo acaba em pizza



chegamos em casa, abalados e incrédulos com o que tinha rolado

ser assaltado por uma pedra é literalmente ser humilhado



no mesmo dia, meu irmão ganhou o iPhone dez, que era de mamãe

sim, é outro detalhe, na minha familia os celulares se movem

todo fim do ano, minha mãe ganha um novo, e aquele que era dela, passa pro meu irmão

e o que era do meu irmão por fim, passa pra mim



e agora o lado engraçado

o celular que no fim do ano seria meu, foi reciclado

ou seja, mais um ano que eu ficaria com meu celular ultrapassado



talvez eu pareça meio chucro

mas se eu tivesse entregado meu celular teria eu saido no lucro?

veja bem, não me leve a mal

mas com meu AO3 eu me sinto um neanderthal 



parando de falar sobre celular, chegou no outro dia

mas já naquela época, eu entendia

foi aí que veio a minha epifania



Drummond, assim como eu, andava despreocupado

e num dia qualquer, voltando da eleição, acabou sendo assaltado

querendo manter a tranquilidade e a serenidade, alguns detalhes no poema foram omitidos

porque sinceramente, ser assaltado por uma pedra é um fato que merece ser escondido



mas veja bem, algo pelo menos me deixou mais seguro

a chance de acontecer de novo fez-me ter  pesadelos noturnos

graças a Deus a eleição municipal de 2024 em salvador durou um só turno de votação

agora imagine como pioraria a minha situação

se no dia 30, eu fosse abordado de novo, na mesma ocasião

por delinquentes empunhando arminhas de bolhinhas de sabão",vesgueiro,1,0.6,1,1754174598.0,brasil,IA,recent,geral
1mg2w40,Sou um cego filho do acaso," Meus pais estavam comendo pão de alho na cozinha agora há pouco, brincando, escutando músicas antigas. Lembrei da história de amor deles. Quis contar para vocês.

 Quando moço, pai era bonitão. Forte, troncudo, cara de poucos amigos e muitos crimes.  Dava medo só de olhar. Um pigarro limpava a rua.  Ficava na porta, gigante, leão de chácara.

 Pura fachada. Nunca gritou. Nunca bateu.  Fugia de briga, achava violência uma barbárie.  Detestava futebol.  Não gostava de malvadeza, tinha dó de tudo.  Em casa, não queria nem ratoeira.  Vivia da pose que o corpo dava.

 Mãe era loira. Polaquinha. Musa pra revista de sacanagem.  Boca vermelha, coxa firme, olho azul que prometia.  Trabalhava no mesmo inferninho.  Sorria. Olhava. Deixava acontecer.

 Se esbarraram. Um mau-passo. Deu barriga. Ele assumiu.  Dela, quem ia fugir? Virou santo de susto.

 Nasci ceguinho. Ninguém sabe por quê.  Não choraram. Não se culparam. Fizeram o que dava.  Juntaram no fim do ano. Sem papel. Sem igreja.  Pai, católico só na quaresma. Mãe torcia o nariz pra padre e governo.  Pecado era enganar os outros.

 Me botaram na escola. Me fizeram gente.  Não passavam a mão. Cego, paciência.  Que estudasse. Pensasse. Lavasse louça. Fosse homem.

 Mãe era dura.  Me obrigou a aprender letra normal, além do Braille.  Pai nunca fez drama. Me ajudava calado.  Até hoje, quando lembra que eu sou cego, o olho molha. Disfarça.  Decerto tem dó. Mas nunca facilitou.

 Treze anos. Me mandou sozinho pra escola. Bater bengala na rua. Sem choro. Fosse macho.  Não pediu. Mandou. E tava certo.

 Ela estudou. Virou professora. Ele, motorista concursado.  Roupa passada, almoço pronto. Casa pobre, não faltou nada.  Domingo, macarrão com frango. Toalha limpa na cozinha.

 Detestavam desleixo. Detestavam fedor.  Nunca perderam um dente. Nunca caiu cabelo.  Eu já ando calvo. Pai não. Cabeludo, barbudo.  Mãe, cabelo comprido, embranqueceu sem avisar.

 Nunca quiseram outro filho. Ficou só eu. Baixo. Cego. Concursado como o pai, mesmo que em outro cargo. Gabola.  Pele muito branca, cabelo loiro puxado dela. Do pai, puxei o corpo parrudo, braço grosso, tronco largo, cara de mau. Jeito de capanga, alma de monge.

 Hoje estão velhos. Ainda juntos. Ainda bonitos. Ela, tipo Vera Fischer. Ele, velho comprido, ainda imponente. Não gostam de barulho, não gostam de gente. Ela reclama do governo. Ele reclama da pressão. Um ameaça ir embora. O outro manda ir. Ninguém vai.",sEstatutario,242,0.95,20,1754172994.0,brasil,IA,recent,geral
1mg27h8,Setor de infraestrutura vive entusiasmo e vê ciclo atual como o mais promissor desde 1970,,strachey,36,0.93,3,1754171140.0,brasil,IA,recent,geral
1fssy73,"Na Globo, o Fantástico está usando imagens de INTELIGÊNCIA ARTIFICIAL pra ilustrar reportagens. O que acham?",,eraldopontopdf,2025,0.94,536,1727694703.0,brasil,inteligência artificial,search,geral
1lult2y,"O vídeo que você está vendo agora não foi gerado por inteligência artificial: A contradição do partido de Hugo Motta e Tarcísio de Freitas, que prega austeridade mas esbanja com dinheiro público.",Fonte: Intercept Brasil,ril3ydx,2071,0.96,123,1751973075.0,brasil,inteligência artificial,search,geral
1jpcjv4,Utilizar a inteligência artificial para melhorar a qualidade e colorizar fotos antigas é ético?,"Pedi para o ChatGPT fazer isso para algumas imagens visto que só se encontra imagens de baixa qualidade deles no Google e isso é algo que me incomoda um pouco. Algumas como a do Luiz Gama eu gostei, achei fiel, outras foram problemáticas.

Em ordem:

1. Luiz Gama

2. José do Patrocínio

3. Tavares Bastos. Parece que deu uma mexida no maxilar do homem

4. Alberto Santos Dumont

5. Rui Barbosa, achei que o rosto ficou muito diferente

6. Castro Alves, a foto ficou levemente alterada

7. Graciliano Ramos

8. Barão de Mauá

9. Aluísio de Azevedo

10. Marighella

11. Visconde de Cairu, acho que a imagem original não ajuda muito

12. Machado de Assis. O ChatGPT teve problema para recriar esse, quando disse que ele na verdade era negro e não branco ele começou a alterar os traços da foto ",rdfporcazzo,955,0.86,258,1743556916.0,brasil,inteligência artificial,search,geral
1m8niz2,"EUA — Novo decreto presidencial sobre IA: a inteligência artificial deve refletir as visões do governo sobre sexo e raça, e está proibida de fazer referência a conceitos como racismo estrutural, viés inconsciente, interseccionalidade ou ""transgeneridade""",,UnreliableSRE,866,0.99,156,1753410602.0,brasil,inteligência artificial,search,geral
1iwqcua,A inteligência artificial chegou ao carnaval,,Capyvara,2383,0.99,51,1740360844.0,brasil,inteligência artificial,search,geral
1mcf44w,É #FAKE vídeo de Moraes dizendo que errou com Bolsonaro e vai apoiá-lo na eleição de 2026; cena foi criada com inteligência artificial,,Hykfer,631,0.98,68,1753804340.0,brasil,inteligência artificial,search,geral
1kqakzw,Globo usando Imagens geradas por IA,"Acho isso meio estranho e não é a primeira vez q vejo eles usando. O pessoal tem infraestrutura pra fazer algo decente mas prefere usar o chat gpt. O que acham disso?

Imagens exibidas no Domingão com o Huck 18/05/2025",Cold_Comparison_7204,1227,0.96,328,1747658168.0,brasil,IA,search,geral
1kgf9qp,É dificil acreditar que um canal que sempre foi referência de qualidade no YTBR agora usa essas imagens mal feitas geradas por IA sem necessidade alguma,,Caolhoeoq,1096,0.81,588,1746564387.0,brasil,IA,search,geral
1i0kz3k,Usar IA pra fazer TCC já é demais viu,,Bpbegha,1320,0.99,260,1736793331.0,brasil,IA,search,geral
